<!ELEMENT placasBase (placaBase+)>
<!ELEMENT placaBase (microprocesador, memoria, modelo, fabricante)>
<!ELEMENT microprocesador (#PCDATA)>
<!ELEMENT memoria (#PCDATA)>
<!ELEMENT modelo (#PCDATA)>
<!ELEMENT fabricante ((Intel | Asus))>
<!ELEMENT Intel EMPTY>
<!ELEMENT Asus EMPTY>